Bus Hound 6.01 capture on Windows Vista Service Pack 1 (x86). Complements of www.perisoft.net

cd4

  Device - Device ID (followed by the endpoint for USB devices)
            (10) м╗пе╤к©з (COM1)
            (24) USB2.0-MIDI
  Phase  - Phase Type
            IN    Data in transfer           
  Data   - Hex dump of the data transferred
  Descr  - Description of the phase
  Cmd... - Position in the captured data


Device  Phase  Data                                                Description       Cmd.Phase.Ofs(rep)
------  -----  --------------------------------------------------  ----------------  ------------------
  10    IN     b0 07 ff b1  07 ff b2 07  ff b3 07 ff  b4 07 ff b5  ................         1.1.0        
               07 ff b6 07  ff b7 07 ff  b8 07 ff b9  07 ff ba 07  ................         1.1.16       
  10    IN     ff bb 07 ff  bc 07 ff bd  07 ff be 07  ff bf 07 ff  ................         2.1.0        
               c0 00 00 b0  0a 40 c0 00  00 b0 0a 40  c0 00 00 b0  .....@.....@....         2.1.16       
  10    IN     90 48 50 90  30 50 90 4c  50 80 30 40               .HP.0P.LP.0@             3.1.0        
  10    IN     90 4f 50                                            .OP                      4.1.0        
  10    IN     80 48 40                                            .H@                      5.1.0        
  10    IN     90 37 50                                            .7P                      6.1.0        
  10    IN     80 37 40                                            .7@                      7.1.0        
  10    IN     80 4c 40                                            .L@                      8.1.0        
  10    IN     90 4f 50                                            .OP                      9.1.0        
  10    IN     80 4f 40 90  3c 50 80 3c  40                        .O@.<P.<@               10.1.0        
  10    IN     80 4f 40                                            .O@                     11.1.0        
  10    IN     90 4f 50                                            .OP                     12.1.0        
  10    IN     80 4f 40 90  40 50 80 40  40                        .O@.@P.@@               13.1.0        
  10    IN     90 4c 50 80  4c 40                                  .LP.L@                  14.1.0        
  10    IN     90 4f 50 80  4f 40                                  .OP.O@                  15.1.0        
  10    IN     90 2d 50                                            .-P                     16.1.0        
  10    IN     90 51 50                                            .QP                     17.1.0        
  10    IN     80 51 40                                            .Q@                     18.1.0        
  10    IN     80 2d 40                                            .-@                     19.1.0        
  10    IN     90 34 50 80  34 40                                  .4P.4@                  20.1.0        
  10    IN     90 51 50                                            .QP                     21.1.0        
  10    IN     80 51 40 90  39 50                                  .Q@.9P                  22.1.0        
  10    IN     80 39 40                                            .9@                     23.1.0        
  10    IN     90 4c 50 90  3b 50                                  .LP.;P                  24.1.0        
  10    IN     80 4c 40                                            .L@                     25.1.0        
  10    IN     80 3b 40                                            .;@                     26.1.0        
  10    IN     90 3c 50                                            .<P                     27.1.0        
  10    IN     80 3c 40                                            .<@                     28.1.0        
  10    IN     90 4a 50                                            .JP                     29.1.0        
  10    IN     80 4a 40                                            .J@                     30.1.0        
  10    IN     90 29 50                                            .)P                     31.1.0        
  10    IN     90 48 50                                            .HP                     32.1.0        
  10    IN     80 48 40 80  29 40                                  .H@.)@                  33.1.0        
  10    IN     90 30 50 80  30 40                                  .0P.0@                  34.1.0        
  10    IN     90 35 50 80  35 40                                  .5P.5@                  35.1.0        
  10    IN     90 4a 50                                            .JP                     36.1.0        
  10    IN     90 2b 50                                            .+P                     37.1.0        
  10    IN     80 4a 40                                            .J@                     38.1.0        
  10    IN     80 2b 40                                            .+@                     39.1.0        
  10    IN     90 32 50 80  32 40                                  .2P.2@                  40.1.0        
  10    IN     90 37 50 80  37 40                                  .7P.7@                  41.1.0        
  10    IN     90 4c 50                                            .LP                     42.1.0        
  10    IN     90 30 50                                            .0P                     43.1.0        
  10    IN     80 4c 40                                            .L@                     44.1.0        
  10    IN     80 30 40                                            .0@                     45.1.0        
  10    IN     90 37 50 80  37 40                                  .7P.7@                  46.1.0        
  10    IN     90 3c 50 80  3c 40                                  .<P.<@                  47.1.0        
  10    IN     90 3e 50                                            .>P                     48.1.0        
  10    IN     80 3e 40                                            .>@                     49.1.0        
  10    IN     90 48 50                                            .HP                     50.1.0        
  10    IN     90 4c 50                                            .LP                     51.1.0        
  10    IN     90 30 50                                            .0P                     52.1.0        
  10    IN     90 4f 50                                            .OP                     53.1.0        
  10    IN     80 48 40                                            .H@                     54.1.0        
  10    IN     80 30 40                                            .0@                     55.1.0        
  10    IN     90 37 50 80  37 40                                  .7P.7@                  56.1.0        
  10    IN     80 4c 40                                            .L@                     57.1.0        
  10    IN     80 4f 40                                            .O@                     58.1.0        
  10    IN     90 4f 50                                            .OP                     59.1.0        
  10    IN     80 4f 40                                            .O@                     60.1.0        
  10    IN     90 3c 50 80  3c 40                                  .<P.<@                  61.1.0        
  10    IN     90 4f 50                                            .OP                     62.1.0        
  10    IN     80 4f 40                                            .O@                     63.1.0        
  10    IN     90 40 50 80  40 40                                  .@P.@@                  64.1.0        
  10    IN     90 4c 50                                            .LP                     65.1.0        
  10    IN     80 4c 40                                            .L@                     66.1.0        
  10    IN     90 4f 50 80  4f 40                                  .OP.O@                  67.1.0        
  10    IN     90 2d 50                                            .-P                     68.1.0        
  10    IN     90 51 50                                            .QP                     69.1.0        
  10    IN     80 51 40                                            .Q@                     70.1.0        
  10    IN     80 2d 40                                            .-@                     71.1.0        
  10    IN     90 34 50                                            .4P                     72.1.0        
  10    IN     80 34 40                                            .4@                     73.1.0        
  10    IN     90 51 50                                            .QP                     74.1.0        
  10    IN     90 39 50                                            .9P                     75.1.0        
  10    IN     80 51 40                                            .Q@                     76.1.0        
  10    IN     80 39 40                                            .9@                     77.1.0        
  10    IN     90 4c 50                                            .LP                     78.1.0        
  10    IN     90 3b 50                                            .;P                     79.1.0        
  10    IN     80 4c 40 80  3b 40                                  .L@.;@                  80.1.0        
  10    IN     90 3c 50                                            .<P                     81.1.0        
  10    IN     80 3c 40                                            .<@                     82.1.0        
  10    IN     90 4a 50                                            .JP                     83.1.0        
  10    IN     80 4a 40                                            .J@                     84.1.0        
  10    IN     90 29 50                                            .)P                     85.1.0        
  10    IN     90 48 50                                            .HP                     86.1.0        
  10    IN     80 48 40                                            .H@                     87.1.0        
  10    IN     80 29 40                                            .)@                     88.1.0        
  10    IN     90 30 50 80  30 40                                  .0P.0@                  89.1.0        
  10    IN     90 35 50 80  35 40                                  .5P.5@                  90.1.0        
  10    IN     90 4a 50                                            .JP                     91.1.0        
  10    IN     90 2b 50                                            .+P                     92.1.0        
  10    IN     80 4a 40                                            .J@                     93.1.0        
  10    IN     80 2b 40                                            .+@                     94.1.0        
  10    IN     90 32 50                                            .2P                     95.1.0        
  10    IN     80 32 40                                            .2@                     96.1.0        
  10    IN     90 37 50 80  37 40                                  .7P.7@                  97.1.0        
  10    IN     90 48 50                                            .HP                     98.1.0        
  10    IN     90 30 50                                            .0P                     99.1.0        
  10    IN     80 48 40                                            .H@                    100.1.0        
  10    IN     80 30 40                                            .0@                    101.1.0        
  10    IN     90 37 50                                            .7P                    102.1.0        
  10    IN     80 37 40                                            .7@                    103.1.0        
  10    IN     90 3c 50 80  3c 40                                  .<P.<@                 104.1.0        
  10    IN     90 40 50                                            .@P                    105.1.0        
  10    IN     80 40 40                                            .@@                    106.1.0        
  10    IN     90 43 50                                            .CP                    107.1.0        
  10    IN     80 43 40                                            .C@                    108.1.0        
  10    IN     90 30 50                                            .0P                    109.1.0        
  10    IN     90 48 50 80  48 40                                  .HP.H@                 110.1.0        
  10    IN     90 40 50                                            .@P                    111.1.0        
  10    IN     90 37 50                                            .7P                    112.1.0        
  10    IN     80 30 40                                            .0@                    113.1.0        
  10    IN     90 37 50                                            .7P                    114.1.0        
  10    IN     80 37 40                                            .7@                    115.1.0        
  10    IN     90 3c 50 80  3c 40                                  .<P.<@                 116.1.0        
  10    IN     80 40 40                                            .@@                    117.1.0        
  10    IN     90 43 50                                            .CP                    118.1.0        
  10    IN     80 43 40                                            .C@                    119.1.0        
  10    IN     90 28 50                                            .(P                    120.1.0        
  10    IN     90 37 50                                            .7P                    121.1.0        
  10    IN     80 28 40                                            .(@                    122.1.0        
  10    IN     90 2f 50 80  2f 40                                  ./P./@                 123.1.0        
  10    IN     90 34 50 80  34 40                                  .4P.4@                 124.1.0        
  10    IN     80 37 40                                            .7@                    125.1.0        
  10    IN     90 29 50                                            .)P                    126.1.0        
  10    IN     90 39 50                                            .9P                    127.1.0        
  10    IN     80 29 40                                            .)@                    128.1.0        
  10    IN     90 30 50 80  30 40                                  .0P.0@                 129.1.0        
  10    IN     90 35 50 80  35 40                                  .5P.5@                 130.1.0        
  10    IN     90 3c 50 90  41 50 80 39  40                        .<P.AP.9@              131.1.0        
  10    IN     90 2b 50 80  3c 40 80 41  40 90 3b 50               .+P.<@.A@.;P           132.1.0        
  10    IN     80 2b 40                                            .+@                    133.1.0        
